{"schemaVersion":"pbl-authorship/2.0.0","packageId":"PKG-COMP-A06-G02-01","title":"Fundamentos de Tipos de Sujeito","unitId":"IP-A06-G02","competencyRef":"COMP-A06-G02-01","learningObjectiveRef":"OBJ-IP-A06-G02-001","scope":{"focus":"Classificação canônica do sujeito: determinado (simples, composto, elíptico/oculto), indeterminado e oração sem sujeito (verbos impessoais).","exclusions":["Não aborda tópicos de pontuação ou semântica estilística desvinculados do tema central.","Não altera enunciados, opções ou gabaritos de questões oficiais de concurso."]},"authorship":{"author":"Especialista Pedagógico de Autoria Semântica - SuVeCa","method":"semantic_authorship_v2_pbl","reviewStatus":"homologated","publicationStatus":"product_ready","model":"gemini-2.5-pro","delegatedSessionId":"author_lote_08","verifiedSha256":"4c7dbe0c01a0854364727d03b2690901ea13baf843656ea47bf0c3e8e0a2d3d0","reviewedAt":"2026-09-09T00:51:14Z","publishedAt":"2026-09-09T00:51:21.996Z"},"sources":[{"id":"SRC-KB-A06-G02-001","collection":"concepts","recordId":"KB-A06-G02-001","pointer":"/definition","supports":"O Algoritmo Tripartite de Análise Sintática do Sujeito"},{"id":"SRC-KB-A06-G02-002","collection":"concepts","recordId":"KB-A06-G02-002","pointer":"/definition","supports":"Natureza Categorial e a Barreira Preposicional do Núcleo do Sujeito"},{"id":"SRC-KB-A06-G02-003","collection":"concepts","recordId":"KB-A06-G02-003","pointer":"/definition","supports":"Sujeito Simples e a Distinção Categorial do Pronome Indefinido"},{"id":"SRC-KB-A06-G02-004","collection":"concepts","recordId":"KB-A06-G02-004","pointer":"/definition","supports":"Sujeito Oculto (Elíptico/Desinencial): Vertente Desinencial vs. Não-Desinencial Anafórica"},{"id":"SRC-KB-A06-G02-005","collection":"concepts","recordId":"KB-A06-G02-005","pointer":"/definition","supports":"As Três Vias Estruturais de Indeterminação do Sujeito"},{"id":"SRC-KB-A06-G02-006","collection":"concepts","recordId":"KB-A06-G02-006","pointer":"/definition","supports":"Oração Sem Sujeito (Sujeito Inexistente) e a Exceção do Sentido Figurado"},{"id":"SRC-KB-A06-G02-007","collection":"concepts","recordId":"KB-A06-G02-007","pointer":"/definition","supports":"Sujeito Oracional, Teste de Validação por \"ISSO\" e Concordância"},{"id":"SRC-KB-A06-G02-008","collection":"concepts","recordId":"KB-A06-G02-008","pointer":"/definition","supports":"Distinção Morfossintática e Sociolinguística do Pronome \"SE\": PA vs. IIS"},{"id":"SRC-KB-A06-G02-009","collection":"concepts","recordId":"KB-A06-G02-009","pointer":"/definition","supports":"Contraste Sintático entre Verbos Impessoais (*Haver*) e Pessoais (*Ocorrer/Existir*)"},{"id":"SRC-RULE-IP-A06-G02-001","collection":"corpus","recordId":"RULE-IP-A06-G02-001","pointer":"/statement","supports":"Regras canônicas"},{"id":"SRC-PROC-A06-G02-001","collection":"concepts","recordId":"PROC-A06-G02-001","pointer":"/steps","supports":"Protocolo Geral em Três Passos para Análise Sintática do Sujeito"},{"id":"SRC-PROC-A06-G02-002","collection":"concepts","recordId":"PROC-A06-G02-002","pointer":"/steps","supports":"Teste da Substituição por \"ISSO\" para Sujeito Oracional"},{"id":"SRC-PROC-A06-G02-003","collection":"concepts","recordId":"PROC-A06-G02-003","pointer":"/steps","supports":"Método \"Viva Cada Verbo a Seu Momento\" em Períodos Compostos"},{"id":"SRC-PROC-A06-G02-004","collection":"concepts","recordId":"PROC-A06-G02-004","pointer":"/steps","supports":"Teste de Conversão para Distinguir Partícula Apassivadora (PA) de Índice de Indeterminação (IIS)"},{"id":"SRC-PROC-A06-G02-005","collection":"concepts","recordId":"PROC-A06-G02-005","pointer":"/steps","supports":"Metodologia de Fragmentação de Assertivas no Padrão Cebraspe"},{"id":"SRC-CONTRAST-IP-A06-G02-001","collection":"concepts","recordId":"CONTRAST-IP-A06-G02-001","pointer":"/decisionCriterion","supports":"Tabela de Contrastes Fundamentais na Sintaxe do Sujeito"},{"id":"SRC-WARN-A06-G02-001","collection":"corpus","recordId":"WARN-A06-G02-001","pointer":"/errorPattern","supports":"Falso Núcleo do Sujeito Regido por Preposição"},{"id":"SRC-WARN-A06-G02-002","collection":"corpus","recordId":"WARN-A06-G02-002","pointer":"/errorPattern","supports":"Confusão entre Pronome Indefinido e Sujeito Indeterminado"},{"id":"SRC-WARN-A06-G02-003","collection":"corpus","recordId":"WARN-A06-G02-003","pointer":"/errorPattern","supports":"Generalização Apressada do Verbo na 3ª Pessoa do Plural"},{"id":"SRC-WARN-A06-G02-004","collection":"corpus","recordId":"WARN-A06-G02-004","pointer":"/errorPattern","supports":"Pluralização Viciosa dos Verbos \"Fazer\" e \"Haver\" Impessoais"},{"id":"SRC-WARN-A06-G02-005","collection":"corpus","recordId":"WARN-A06-G02-005","pointer":"/errorPattern","supports":"Falsa Exigência de Conjunção Integrante no Sujeito Oracional"},{"id":"SRC-WARN-A06-G02-006","collection":"corpus","recordId":"WARN-A06-G02-006","pointer":"/errorPattern","supports":"Atribuição de Sujeito Paciente a Termos Preposicionados"},{"id":"SRC-OQ-A06-estrategia.4000836430","collection":"official","recordId":"OQ-A06-estrategia.4000836430","pointer":"/questionPayload/statement","supports":"Questão Oficial de Concurso OQ-A06-estrategia.4000836430"},{"id":"SRC-OQ-A06-estrategia.4000992683","collection":"official","recordId":"OQ-A06-estrategia.4000992683","pointer":"/questionPayload/statement","supports":"Questão Oficial de Concurso OQ-A06-estrategia.4000992683"},{"id":"SRC-OQ-A06-estrategia.4001038102","collection":"official","recordId":"OQ-A06-estrategia.4001038102","pointer":"/questionPayload/statement","supports":"Questão Oficial de Concurso OQ-A06-estrategia.4001038102"},{"id":"SRC-OQ-A06-estrategia.4001132058","collection":"official","recordId":"OQ-A06-estrategia.4001132058","pointer":"/questionPayload/statement","supports":"Questão Oficial de Concurso OQ-A06-estrategia.4001132058"},{"id":"SRC-OQ-A06-estrategia.4001132693","collection":"official","recordId":"OQ-A06-estrategia.4001132693","pointer":"/questionPayload/statement","supports":"Questão Oficial de Concurso OQ-A06-estrategia.4001132693"},{"id":"SRC-OQ-A06-estrategia.4001245096","collection":"official","recordId":"OQ-A06-estrategia.4001245096","pointer":"/questionPayload/statement","supports":"Questão Oficial de Concurso OQ-A06-estrategia.4001245096"},{"id":"SRC-OQ-A06-estrategia.4001335203","collection":"official","recordId":"OQ-A06-estrategia.4001335203","pointer":"/questionPayload/statement","supports":"Questão Oficial de Concurso OQ-A06-estrategia.4001335203"},{"id":"SRC-OQ-A06-estrategia.4001335431","collection":"official","recordId":"OQ-A06-estrategia.4001335431","pointer":"/questionPayload/statement","supports":"Questão Oficial de Concurso OQ-A06-estrategia.4001335431"},{"id":"SRC-OQ-A06-estrategia.4001422190","collection":"official","recordId":"OQ-A06-estrategia.4001422190","pointer":"/questionPayload/statement","supports":"Questão Oficial de Concurso OQ-A06-estrategia.4001422190"}],"questions":[{"id":"OQ-A06-estrategia.4000836430","sourceKind":"official","sourceRef":"SRC-OQ-A06-estrategia.4000836430","feedback":{"A":"INCORRETO. A alternativa 'I, apenas.' não satisfaz a função sintática ou a correlação normativa requerida pelo enunciado.","B":"INCORRETO. A alternativa 'I e II, apenas' não satisfaz a função sintática ou a correlação normativa requerida pelo enunciado.","C":"INCORRETO. A alternativa 'II e III, apenas' não satisfaz a função sintática ou a correlação normativa requerida pelo enunciado.","D":"INCORRETO. A alternativa 'I e III, apenas' não satisfaz a função sintática ou a correlação normativa requerida pelo enunciado.","E":"CORRETO. GABARITO ALTERNATIVA EI - Correto. Aqui, temos caso de sujeito oracional. O que era impossível? [entender como alguém poderia cometer crime tão cruel] era impossível[ISTO] era impossível II- Correto. Sim, temos duas orações: [Especialistas em imunologia encontraram novas mutações para o coronavírus] e [iniciaram uma adaptação das vacinas então existentes.]O sujeito da segunda oração veio implícito, pois se refere aos especialistas, sujeito da primeira oração: [Especialistas em imunologia iniciaram uma adaptação das vacinas então existentes.]III- Correto. O verbo haver tem sentido existencial, então é impessoal e introduz oração sem sujeito. Lembre-se de que o verbo haver impessoal (ou outro impessoal que o substitua) vem sempre no singular e “contamina” os verbos auxiliares que formam locução com ele:Ex: Há mil pessoas aqui.Ex: Deve haver mil pessoas aqui.Ex: Deve fazer 3 anos que não fumo. Ex: Deve ir para 2 meses que não fumo. Então, na locução, o verbo auxiliar também fica em forma de singular! Se o verbo for pessoal, como “existir”, aí o verbo auxiliar se flexiona normalmente: Ex: Existem mil pessoas aqui.Ex: Devem existir mil pessoas aqui."},"interventionId":"ITV-COMP-A06-G02-01-DOMINIO-AVANCADO"},{"id":"OQ-A06-estrategia.4000992683","sourceKind":"official","sourceRef":"SRC-OQ-A06-estrategia.4000992683","feedback":{"E":"CORRETO. ERRADO.Esta questão trabalha com identificação e classificação do sujeito oracional.Vamos relembrar do sujeito simples e do sujeito oculto:Sujeito simples: Possui apenas um núcleo do sujeito, ou seja: um substantivo, um pronome, um numeral ou uma palavra com valor de substantivo.Exemplo: Maria comeu os chocolates.Sujeito oculto (ou desinencial): O sujeito existe, apenas não se encontra explícito na oração. O sujeito oculto pode ser encontrado:- Através da análise de orações precedentes do mesmo período ou do período anterior. Exemplo: Ele estava com sono. Resolveu escovar os dentes e ir pra cama.- Através da análise da desinência verbal. Exemplo: Comprei um bolo. - a desinência demarcada indica a primeira pessoa do singular (eu).----Vamos observar o trecho:&#34;As espécies de crescimento rápido são as que mais assustam os técnicos responsáveis pela arborização exageradamente tementes à infraestrutura. Todavia, as outras demoram uma eternidade para crescer, a vida passa ligeiramente e todos querem ver a tão so